,Lens ID,Title,Publication Year,Publication Type,Source Title,Publisher,Source Country,Author/s,Abstract,Fields of Study,Keywords,MeSH Terms,DOI,Is Open Access,Lang,Category
153,033-040-950-973-409,A Learning Framework for Medical Image-Based Intelligent Diagnosis from Imbalanced Datasets.,2021,journal article,Studies in health technology and informatics,IOS Press,Netherlands,Tetiana Biloborodova; Inna Skarga-Bandurova; Mark Koverha; Illia Skarha-Bandurov; Yelyzaveta Yevsieieva,"Medical image classification and diagnosis based on machine learning has made significant achievements and gradually penetrated the healthcare industry. However, medical data characteristics such as relatively small datasets for rare diseases or imbalance in class distribution for rare conditions significantly restrains their adoption and reuse. Imbalanced datasets lead to difficulties in learning and obtaining accurate predictive models. This paper follows the FAIR paradigm and proposes a technique for the alignment of class distribution, which enables improving image classification performance in imbalanced data and ensuring data reuse. The experiments on the acne disease dataset support that the proposed framework outperforms the baselines and enable to achieve up to 5% improvement in image classification.",Machine learning; Artificial intelligence; Reuse; Data reuse; Image based; Healthcare industry; Imbalanced data; Class (biology); Computer science; Contextual image classification; Class (philosophy); Image (mathematics); Data mining; Pattern recognition (psychology); Engineering; Waste management,Medical image classification; imbalanced data; machine learning oversampling,Diagnostic Imaging; Machine Learning,10.3233/shti210801,True,en,Overview and Adoption of FAIR Principles
166,035-200-796-057-420,Distributed learning on 20 000+ lung cancer patients - The Personal Health Train.,2020,journal article,Radiotherapy and oncology : journal of the European Society for Therapeutic Radiology and Oncology,Elsevier Ireland Ltd,Netherlands,Timo M. Deist; Frank J. W. M. Dankers; Priyanka Ojha; M. Scott Marshall; Tomas Janssen; Corinne Faivre-Finn; Carlotta Masciocchi; Vincenzo Valentini; Jiazhou Wang; Jiayan Chen; Zhen Zhang; Emiliano Spezi; M. Button; Joost J. Nuyttens; René M. Vernhout; Johan van Soest; Arthur Jochems; René Monshouwer; Johan Bussink; Gareth J Price; Philippe Lambin; Andre Dekker,"Background and purpose Access to healthcare data is indispensable for scientific progress and innovation. Sharing healthcare data is time-consuming and notoriously difficult due to privacy and regulatory concerns. The Personal Health Train (PHT) provides a privacy-by-design infrastructure connecting FAIR (Findable, Accessible, Interoperable, Reusable) data sources and allows distributed data analysis and machine learning. Patient data never leaves a healthcare institute. Materials and methods Lung cancer patient-specific databases (tumor staging and post-treatment survival information) of oncology departments were translated according to a FAIR data model and stored locally in a graph database. Software was installed locally to enable deployment of distributed machine learning algorithms via a central server. Algorithms (MATLAB, code and documentation publicly available) are patient privacy-preserving as only summary statistics and regression coefficients are exchanged with the central server. A logistic regression model to predict post-treatment two-year survival was trained and evaluated by receiver operating characteristic curves (ROC), root mean square prediction error (RMSE) and calibration plots. Results In 4 months, we connected databases with 23 203 patient cases across 8 healthcare institutes in 5 countries (Amsterdam, Cardiff, Maastricht, Manchester, Nijmegen, Rome, Rotterdam, Shanghai) using the PHT. Summary statistics were computed across databases. A distributed logistic regression model predicting post-treatment two-year survival was trained on 14 810 patients treated between 1978 and 2011 and validated on 8 393 patients treated between 2012 and 2015. Conclusion The PHT infrastructure demonstrably overcomes patient privacy barriers to healthcare data sharing and enables fast data analyses across multiple institutes from different countries with different regulatory regimens. This infrastructure promotes global evidence-based medicine while prioritizing patient privacy.",Software deployment; Logistic regression; Health care; Graph database; Interoperability; Data science; Computer science; Documentation; Big data; Data model,Big data; Distributed learning; FAIR data; Federated learning; Lung cancer; Machine learning; Prediction modeling; Survival analysis,Algorithms; China; Humans; Lung Neoplasms; Machine Learning; Privacy,10.1016/j.radonc.2019.11.019,True,en,Infrastructure and Tools
169,035-524-672-872-432,Road to FAIR genomes: a gap analysis of NGS data generation and sharing in the Netherlands.,2022,journal article,BMJ open science,Portico,England,Jeroen A M Belien; Anke E Kip; Morris A Swertz,"<AbstractText Label=""Objective"" NlmCategory=""UNASSIGNED"">This study investigates current standards and operational gaps in the management and sharing of next generation sequencing (NGS) data within the healthcare and research setting and according to Findable, Accessible, Interoperable and Reusable (FAIR) principles.</AbstractText>;           <AbstractText Label=""Methods"" NlmCategory=""UNASSIGNED"">The analysis was performed as the basis from which to bridge identified gaps and develop widely accepted working standards that ensure optimal reusability of genomic data in healthcare and research settings in the Netherlands. This work is part of the 'Rational Pharmacotherapy Program' led by ZonMw, The Netherlands Organisation for Health Research and Development, which aims to promote the efficient implementation of NGS and personalised medicine within Dutch healthcare, with an initial focus on oncology and rare diseases.</AbstractText>;           <AbstractText Label=""Results"" NlmCategory=""UNASSIGNED"">Based on this analysis and as part of this programme, a consortium was formed to develop an instruction manual for FAIR genomic data in clinical care and research based on an inventory of commonly used workflows and standards in the (inter)national field of genome analysis.</AbstractText>;           <AbstractText Label=""Conclusions"" NlmCategory=""UNASSIGNED"">The gap analysis presented and discussed in this paper represents the starting point for this inventory and is a possible contribution from the Netherlands to the European 1+ Million Genomes Initiative. This paper addresses the topics of data generation, data quality, (meta)data standards, data storage and archiving and data integration and exchange.</AbstractText>;           <CopyrightInformation>© Author(s) (or their employer(s)) 2022. Re-use permitted under CC BY. Published by BMJ.</CopyrightInformation>",Interoperability; Workflow; Computer science; Data sharing; Data science; Health care; Data management; Best practice; Data exchange; World Wide Web; Data mining; Medicine; Political science; Database; Alternative medicine; Pathology; Law,informatics; translational medical research,,10.1136/bmjos-2021-100268,True,en,Overview and Adoption of FAIR Principles
187,039-075-851-664-49X,FAIR Machine Learning Model Pipeline Implementation of COVID-19 Data,2022,journal article,Data Intelligence,MIT Press,,Sakinat Folorunso; Ezekiel Ogundepo; Mariam Basajja; Joseph Awotunde; Abdullahi Kawu; Francisca Oladipo; Abdullahi Ibrahim,"<jats:title>Abstract</jats:title>;                <jats:p>Research and development are gradually becoming data-driven and the implementation of the FAIR Guidelines (that data should be Findable, Accessible, Interoperable, and Reusable) for scientific data administration and stewardship has the potential to remarkably enhance the framework for the reuse of research data. In this way, FAIR is aiding digital transformation. The ‘FAIRification’ of data increases the interoperability and (re)usability of data, so that new and robust analytical tools, such as machine learning (ML) models, can access the data to deduce meaningful insights, extract actionable information, and identify hidden patterns. This article aims to build a FAIR ML model pipeline using the generic FAIRification workflow to make the whole ML analytics process FAIR. Accordingly, FAIR input data was modelled using a FAIR ML model. The output data from the FAIR ML model was also made FAIR. For this, a hybrid hierarchical k-means (HHK) clustering ML algorithm was applied to group the data into homogeneous subgroups and ascertain the underlying structure of the data using a Nigerian-based FAIR dataset that contains data on economic factors, healthcare facilities, and coronavirus occurrences in all the 36 states of Nigeria. The model showed that research data and the ML pipeline can be FAIRified, shared, and reused by following the proposed FAIRification workflow and implementing technical architecture.</jats:p>",Workflow; Interoperability; Computer science; Pipeline (software); Usability; Analytics; Data model (GIS); Data mining; Data transformation; Data modeling; Database; Reuse; Data science; Artificial intelligence; World Wide Web; Engineering; Data warehouse; Human–computer interaction; Programming language; Waste management,,,10.1162/dint_a_00182,True,en,FAIRification of data
237,048-710-037-813-880,Clinical Research Informatics: Contributions from 2016.,2017,journal article,Yearbook of medical informatics,Georg Thieme Verlag KG,Germany,C. Daniel; R. Choquet,"Objectives: To summarize key contributions to current research in the field of Clinical Research Informatics (CRI) and to select the best papers published in 2016. Methods: A bibliographic search using a combination of MeSH and free terms on CRI was performed using PubMed, followed by a double-blind review in order to select a list of candidate best papers to be then peer-reviewed by external reviewers. A consensus meeting between the two section editors and the editorial team was organized to finally conclude on the selection of best papers. Results: Among the 452 papers published in 2016 in the various areas of CRI and returned by the query, the full review process selected four best papers. The authors of the first paper utilized a comprehensive representation of the patient medical record and semi-automatically labeled training sets to create phenotype models via a machine learning process. The second selected paper describes an open source tool chain securely connecting ResearchKit compatible applications (Apps) to the widely-used clinical research infrastructure Informatics for Integrating Biology and the Bedside (i2b2). The third selected paper describes the FAIR Guiding Principles for scientific data management and stewardship. The fourth selected paper focuses on the evaluation of the risk of privacy breaches in releasing genomics datasets. Conclusions: A major trend in the 2016 publications is the variety of research on “real-world data” – healthcare-generated data, person health data, and patient-reported outcomes - highlighting the opportunities provided by new machine learning techniques as well as new potential risks of privacy breaches.",Variety (cybernetics); Data management; Informatics; Data science; Guiding Principles; Stewardship; Field (computer science); Process (engineering); Data integration,,Biomedical Research; Clinical Trials as Topic; Confidentiality; Humans; Medical Informatics; Observational Studies as Topic,10.15265/iy-2017-024,True,en,Overview and Adoption of FAIR Principles
243,050-758-119-664-975,Recommendations for Improving the Quality of Rare Disease Registries.,2018,journal article,International journal of environmental research and public health,MDPI AG,Switzerland,Yllka Kodra; Jérôme Weinbach; Manuel Posada-de-la-Paz; Alessio Coi; S Lydie Lemonnier; David van Enckevort; Marco Roos; Annika Jacobsen; Ronald Cornet; S Faisal Ahmed; Virginie Bros-Facer; Veronica Popa; Marieke Van Meel; Daniel Renault; Rainald von Gizycki; Michele Santoro; Paul Landais; Paola Torreri; Claudio Carta; Deborah Mascalzoni; Sabina Gainotti; Estrella Lopez; Anna Ambrosini; Heimo Müller; Robert Reis; Fabrizio Bianchi; Yaffa R. Rubinstein; Hanns Lochmüller; Domenica Taruscio,"Rare diseases (RD) patient registries are powerful instruments that help develop clinical research, facilitate the planning of appropriate clinical trials, improve patient care, and support healthcare management. They constitute a key information system that supports the activities of European Reference Networks (ERNs) on rare diseases. A rapid proliferation of RD registries has occurred during the last years and there is a need to develop guidance for the minimum requirements, recommendations and standards necessary to maintain a high-quality registry. In response to these heterogeneities, in the framework of RD-Connect, a European platform connecting databases, registries, biobanks and clinical bioinformatics for rare disease research, we report on a list of recommendations, developed by a group of experts, including members of patient organizations, to be used as a framework for improving the quality of RD registries. This list includes aspects of governance, Findable, Accessible, Interoperable and Reusable (FAIR) data and information, infrastructure, documentation, training, and quality audit. The list is intended to be used by established as well as new RD registries. Further work includes the development of a toolkit to enable continuous assessment and improvement of their organizational and data quality.",Biobank; Health administration; Quality audit; Business; Health care; Information system; Data quality; Documentation; Knowledge management; Continuous assessment,patient registry; quality; rare diseases,Biomedical Research; Computational Biology; Data Accuracy; Europe; Humans; Information Storage and Retrieval/standards; Quality Improvement; Rare Diseases; Registries/standards,10.3390/ijerph15081644,True,en,Overview and Adoption of FAIR Principles
326,073-812-278-254-788,Applying the FAIR principles to data in a hospital: challenges and opportunities in a pandemic.,2022,journal article,Journal of biomedical semantics,Springer Science and Business Media LLC,United Kingdom,Núria Queralt-Rosinach; Rajaram Kaliyaperumal; César H Bernabé; Qinqin Long; Simone A Joosten; Henk Jan van der Wijk; Erik L A Flikkenschild; Kees Burger; Annika Jacobsen; Barend Mons; Marco Roos; null null; null null,"<AbstractText Label=""BACKGROUND"">The COVID-19 pandemic has challenged healthcare systems and research worldwide. Data is collected all over the world and needs to be integrated and made available to other researchers quickly. However, the various heterogeneous information systems that are used in hospitals can result in fragmentation of health data over multiple data 'silos' that are not interoperable for analysis. Consequently, clinical observations in hospitalised patients are not prepared to be reused efficiently and timely. There is a need to adapt the research data management in hospitals to make COVID-19 observational patient data machine actionable, i.e. more Findable, Accessible, Interoperable and Reusable (FAIR) for humans and machines. We therefore applied the FAIR principles in the hospital to make patient data more FAIR.</AbstractText>;           <AbstractText Label=""RESULTS"">In this paper, we present our FAIR approach to transform COVID-19 observational patient data collected in the hospital into machine actionable digital objects to answer medical doctors' research questions. With this objective, we conducted a coordinated FAIRification among stakeholders based on ontological models for data and metadata, and a FAIR based architecture that complements the existing data management. We applied FAIR Data Points for metadata exposure, turning investigational parameters into a FAIR dataset. We demonstrated that this dataset is machine actionable by means of three different computational activities: federated query of patient data along open existing knowledge sources across the world through the Semantic Web, implementing Web APIs for data query interoperability, and building applications on top of these FAIR patient data for FAIR data analytics in the hospital.</AbstractText>;           <AbstractText Label=""CONCLUSIONS"">Our work demonstrates that a FAIR research data management plan based on ontological models for data and metadata, open Science, Semantic Web technologies, and FAIR Data Points is providing data infrastructure in the hospital for machine actionable FAIR Digital Objects. This FAIR data is prepared to be reused for federated analysis, linkable to other FAIR data such as Linked Open Data, and reusable to develop software applications on top of them for hypothesis generation and knowledge discovery.</AbstractText>;           <CopyrightInformation>© 2022. The Author(s).</CopyrightInformation>",Interoperability; Metadata; Computer science; Analytics; Data science; Open data; Health care; Observational study; World Wide Web; Medicine; Economics; Economic growth; Pathology,FAIR; Hospital; Ontologies; Open science; Patient data; Research data management,COVID-19/epidemiology; Hospitals; Humans; Metadata; Pandemics; Semantic Web,10.1186/s13326-022-00263-7,True,en,FAIRification of data
347,081-393-517-949-816,From big data to better patient outcomes.,2022,journal article,Clinical chemistry and laboratory medicine,Walter de Gruyter GmbH,Germany,Tim Hulsen; David Friedecký; Harald Renz; Els Melis; Pieter Vermeersch; Pilar Fernandez-Calle,"Among medical specialties, laboratory medicine is the largest producer of structured data and must play a crucial role for the efficient and safe implementation of big data and artificial intelligence in healthcare. The area of personalized therapies and precision medicine has now arrived, with huge data sets not only used for experimental and research approaches, but also in the ""<i>real world</i>"". Analysis of real world data requires development of legal, procedural and technical infrastructure. The integration of all clinical data sets for any given patient is important and necessary in order to develop a patient-centered treatment approach. Data-driven research comes with its own challenges and solutions. The Findability, Accessibility, Interoperability, and Reusability (FAIR) Guiding Principles provide guidelines to make data findable, accessible, interoperable and reusable to the research community. Federated learning, standards and ontologies are useful to improve robustness of artificial intelligence algorithms working on big data and to increase trust in these algorithms. When dealing with big data, the univariate statistical approach changes to multivariate statistical methods significantly shifting the potential of big data. Combining multiple omics gives previously unsuspected information and provides understanding of scientific questions, an approach which is also called the systems biology approach. Big data and artificial intelligence also offer opportunities for laboratories and the <i>In Vitro</i> Diagnostic industry to optimize the productivity of the laboratory, the quality of laboratory results and ultimately patient outcomes, through tools such as predictive maintenance and ""moving average"" based on the aggregate of patient results.",,artificial intelligence; big data; data science; patient outcomes; personalized healthcare; precision medicine,Humans; Big Data; Artificial Intelligence; Algorithms; Delivery of Health Care; Precision Medicine/methods,10.1515/cclm-2022-1096,False,en,Overview and Adoption of FAIR Principles
369,089-669-875-130-785,The burden of Chronic Pelvic Pain (CPP): Costs and quality of life of women and men with CPP treated in outpatient referral centers.,2023,journal article,PloS one,Public Library of Science (PLoS),United States,David Hutton; Aida Mustafa; Soha Patil; Saira Rathod; Gautam Shrikhande; Arnold Advincula; Jessica Drummond; Peter Gregersen; Jason Hall; Christine Metz; Alexandra Milspaw; Iris Kerin Orbuch; Peter Stahl; Amy Stein; Allyson Shrikhande,"<AbstractText Label=""INTRODUCTION"">Chronic Pelvic Pain (CPP) is a complex, multifaceted condition that affects both women and men. There is limited literature on the cost utilization the healthcare system and CPP patients incur. The purpose of this analysis is to characterize the overall healthcare utilization, cost burden, and quality-of-life restrictions experienced by CPP patients using data from an outpatient pelvic rehabilitation practice.</AbstractText>;           <AbstractText Label=""METHODS"">Healthcare utilization data was gathered by systematically reviewing and analyzing data from new patient visit progress notes stored in the clinic's electronic health records (EHR). We obtained in-network costs by using the FAIR Health Consumer online database. Overall costs were then calculated as the utilization times the per-unit costs from the FAIR database. Additionally, data on patients' visual analogue scale (VAS), absenteeism, presenteeism emergency room visits, usage of common pain medications, use of diagnostics, and participation in common treatment modalities was gathered.</AbstractText>;           <AbstractText Label=""RESULTS"">Data from 607 patients was used. The overall cost burden per patient for all surgeries combined was $15,750 for in-network services. The cost burden for diagnostics was $5,264.22 and treatments was $8,937 per patient for in-network treatments.</AbstractText>;           <AbstractText Label=""CONCLUSION"">Chronic Pelvic Pain was found to have a large cost burden of $29,951 for in-network services which includes treatments, diagnostics, and surgeries. This analysis sets the stage for future investigations involving data on costs of medications that patients have tried prior to presenting to us and costs associated with work hours lost.</AbstractText>;           <CopyrightInformation>Copyright: © 2023 Hutton et al. This is an open access article distributed under the terms of the Creative Commons Attribution License, which permits unrestricted use, distribution, and reproduction in any medium, provided the original author and source are credited.</CopyrightInformation>",Medicine; Referral; Health care; Presenteeism; Quality of life (healthcare); Absenteeism; Indirect costs; Cost driver; Medical emergency; Emergency medicine; Physical therapy; Family medicine; Nursing; Business; Management; Accounting; Marketing; Economics; Economic growth,,Male; Humans; Female; Quality of Life; Outpatients; Patient Acceptance of Health Care; Pain Measurement; Pelvic Pain/therapy; Chronic Pain/therapy,10.1371/journal.pone.0269828,True,en,Overview and Adoption of FAIR Principles
415,108-523-909-056-946,Applying FAIR Principles to Improve Data Searchability of Emergency Department Datasets: A Case Study for HCUP-SEDD,2020,journal article,Methods of information in medicine,Georg Thieme Verlag KG,Germany,Karishma Bhatia; James Tanch; Elizabeth S. Chen; Indra Neil Sarkar,"Background There is a recognized need to improve how scholarly data are managed and accessed. The scientific community has proposed the findable, accessible, interoperable, and reusable (FAIR) data principles to address this issue. Objective The objective of this case study was to develop a system for improving the FAIRness of Healthcare Cost and Utilization Project's State Emergency Department Databases (HCUP's SEDD) within the context of data catalog availability. Methods A search tool, EDCat (Emergency Department Catalog), was designed to improve the “FAIRness” of electronic health databases and tested on datasets from HCUP-SEDD. ElasticSearch was used as a database for EDCat's search engine. Datasets were curated and defined. Searchable data dictionary-related elements and unified medical language system (UMLS) concepts were included in the curated metadata. Functionality to standardize search terms using UMLS concepts was added to the user interface. Results The EDCat system improved the overall FAIRness of HCUP-SEDD by improving the findability of individual datasets and increasing the efficacy of searches for specific data elements and data types. Discussion The databases considered for this case study were limited in number as few data distributors make the data dictionaries of datasets available. The publication of data dictionaries should be encouraged through the FAIR principles, and further efforts should be made to improve the specificity and measurability of the FAIR principles. Conclusion In this case study, the distribution of datasets from HCUP-SEDD was made more FAIR through the development of a search tool, EDCat. EDCat will be evaluated and developed further to include datasets from other sources.",Data type; Findability; Interoperability; Information retrieval; Context (language use); Computer science; Unified Medical Language System; User interface; Metadata; Data dictionary,,"Databases, Factual; Emergency Service, Hospital; Health Information Interoperability; Health Services Accessibility; Information Storage and Retrieval; Metadata",10.1055/s-0040-1712510,False,en,Overview and Adoption of FAIR Principles
