,Lens ID,Title,Publication Year,Publication Type,Source Title,Publisher,Source Country,Author/s,Abstract,Fields of Study,Keywords,MeSH Terms,DOI,Is Open Access,Lang,Category
420,110-383-161-631-495,Preparing healthcare delivery organizations for managing computable knowledge.,2018,journal article,Learning health systems,Wiley,United States,Julia Adler-Milstein; Paige Nong; Charles P. Friedman,"Introduction The growth of data science has led to an explosion in new knowledge alongside various approaches to representing and sharing biomedical knowledge in computable form. These changes have not been matched by an understanding of what healthcare delivery organizations need to do to adapt and continuously deploy computable knowledge. It is therefore important to begin to conceptualize such changes in order to facilitate routine and systematic application of knowledge that improves the health of individuals and populations. Methods An AHRQ-funded conference convened a group of experts from a range of fields to analyze the current state of knowledge management in healthcare delivery organizations and describe how it needs to evolve to enable computable knowledge management. Presentations and discussions were recorded and analyzed by the author team to identify foundational concepts and new domains of healthcare delivery organization knowledge management capabilities. Results Three foundational concepts include 1) the current state of knowledge management in healthcare delivery organizations relies on an outdated biomedical library model, and only a small number of organizations have developed enterprise-scale knowledge management approaches that ""push"" knowledge in computable form to frontline decisions, 2) the concept of Learning Health Systems creates an imperative for scalable computable knowledge management approaches, and 3) the ability to represent data science discoveries in computable form that is FAIR (findable, accessible, interoperable, reusable) is fundamental to spread knowledge at scale. For healthcare delivery organizations to engage with computable knowledge management at scale, they will need new organizational capabilities across three domains: policies and processes, technology, and people. Examples of specific capabilities were developed. Conclusions Healthcare delivery organizations need to substantially scale up and retool their knowledge management approaches in order to benefit from computable biomedical knowledge.",Order (exchange); Interoperability; Scale (chemistry); Library model; Biomedical knowledge; Healthcare delivery; Computer science; Scalability; Concept learning; Knowledge management,healthcare delivery; knowledge management; organizational competencies,,10.1002/lrh2.10070,True,en,Overview and Adoption of FAIR Principles
434,117-836-362-655-518,Fast Healthcare Interoperability Resources (FHIR) in a FAIR Metadata Registry for COVID-19 Research.,2021,journal article,Studies in health technology and informatics,IOS Press,Netherlands,Sophie Anne Ines Klofenstein; Carina Nina Vorisek; Aliaksandra Shutsko; Moritz Lehne; Julian Sass; Matthias Löbe; Carsten Oliver Schmidt; Sylvia Thun,"Adopting international standards within health research communities can elevate data FAIRness and widen analysis possibilities. The purpose of this study was to evaluate the mapping feasibility against HL7® Fast Healthcare Interoperability Resources® (FHIR)® of a generic metadata schema (MDS) created for a central search hub gathering COVID-19 health research (studies, questionnaires, documents = MDS resource types). Mapping results were rated by calculating the percentage of FHIR coverage. Among 86 items to map, total mapping coverage was 94%: 50 (58%) of the items were available as standard resources in FHIR and 31 (36%) could be mapped using extensions. Five items (6%) could not be mapped to FHIR. Analyzing each MDS resource type, there was a total mapping coverage of 93% for studies and 95% for questionnaires and documents, with 61% of the MDS items available as standard resources in FHIR for studies, 57% for questionnaires and 52% for documents. Extensions in studies, questionnaires and documents were used in 32%, 38% and 43% of items, respectively. This work shows that FHIR can be used as a standardized format in registries for clinical, epidemiological and public health research. However, further adjustments to the initial MDS are recommended - and two additional items even needed when implementing FHIR. Developing a MDS based on the FHIR standard could be a future approach to reduce data ambiguity and foster interoperability.",Health care; Interoperability; Information retrieval; Metadata registry; Metadata schema; 2019-20 coronavirus outbreak; Coronavirus disease 2019 (COVID-19); Computer science; Resource (project management); Metadata; Data science; World Wide Web; Economics; Economic growth,COVID-19; FAIR data; Fast Healthcare Interoperability Resources; HL7 FHIR; Infrastructure; Metadata Standards; Syntactic Interoperability,COVID-19; Delivery of Health Care; Electronic Health Records; Health Level Seven; Humans; Metadata; Registries; SARS-CoV-2,10.3233/shti210817,True,en,Overview and Adoption of FAIR Principles
437,118-391-836-896-24X,The COVID - Curated and Open aNalysis aNd rEsearCh plaTform (CO-CONNECT).,2022,journal article,International Journal of Population Data Science,Swansea University,,Emily Jefferson; Aziz Sheik; Susan Hopkins; Philip Quinlan,"<jats:p>ObjectivesCO-CONNECT is making UK COVID-19 data Findable, Accessible, Interoperable and Reusable (FAIR) through a federated platform, which supports secure, anonymised research at scale and pace. This interdisciplinary project, spanning 22 organisations, is connecting data from &gt;50 large research cohorts and data collected through routine healthcare provision across the UK.; ApproachAcross the UK, data has been collected that can help us answer key questions about COVID-19. As the data are in many places with many different processes it is difficult and complex for public health groups, researchers, policymakers, and government to find and access lots of high-quality data quickly and efficiently to make decisions. In collaboration with Health Data Research UK, CO-CONNECT is streamlining processes of accessing data for research.; Results1) Discovering data and meta-analysis: CO-CONNECT enables researchers to determine how many people meet their research criteria within the various datasets across the UK through the Health Data Research Innovation Gateway Cohort Discovery tool e.g. “How many people in each dataset have had a PCR test which was positive and were under the age of 40?” Only summary level, anonymous data are provided so researchers can answer such questions rapidly without requiring multiple data governance permissions and directly contacting each data source. The tool also supports aggregate level meta-analysis of the data.; 2) Detailed analysis: With data governance approvals, researchers can analyse detailed level, standardised, linked, pseudonymised data in a Trusted Research Environment. The common format reduces the effort on each research project, supporting rapid research.; ConclusionProviding data in this de-identifiable, safe way enables rapid, robust research e.g., COVID-19 results from a test centre can be linked to hospital records along with prescriptions from pharmacies enabling researchers to understand whether people with different existing health conditions are more or less susceptible to COVID-19. If you want to know more visit https://co-connect.ac.uk.</jats:p>",Data governance; Interoperability; Data science; Government (linguistics); Computer science; Data quality; Data sharing; Gateway (web page); Open data; World Wide Web; Knowledge management; Business; Medicine; Metric (unit); Linguistics; Philosophy; Alternative medicine; Pathology; Marketing,,,10.23889/ijpds.v7i3.1792,True,en,Overview and Adoption of FAIR Principles
456,129-155-513-569-134,"Connecting data, tools and people across Europe: ELIXIR's response to the COVID-19 pandemic.",2020,journal article,European journal of human genetics : EJHG,Springer Science and Business Media LLC,United Kingdom,Niklas Blomberg; Katharina B Lauer,"ELIXIR, the European research infrastructure for life science data, provides open access to data, tools and workflows in the response to the COVID-19 pandemic. ELIXIR’s 23 nodes have reacted swiftly to support researchers in their combined efforts against the pandemic setting out three joint priorities: 1. Connecting national COVID-19 data platforms to create federated European COVID-19 Data Spaces; 2. Fostering good data management to make COVID-19 data open, FAIR and reusable over the long term; 3. Providing open tools, workflows and computational resources to drive reproducible and collaborative science. ELIXIR’s strategy is based on the support given by our national nodes - collectively spanning over 200 institutes - to research projects and on partnering with community initiatives to drive development and adoption of good data practice and community driven standards. ELIXIR Nodes provide support activities locally and internationally, from provisioning compute capabilities to helping collect viral sequence data from hospitals. Some Nodes have prioritised access to their national cloud and compute facilities for all COVID-19 research projects, while others have developed tools to search, access and share all data related to the pandemic in a national healthcare setting.",Elixir (programming language); Business; Health care; Data management; Provisioning; Workflow; Datasets as Topic; Data access; Knowledge management; Cloud computing,,"Betacoronavirus/genetics; Biomedical Research/organization & administration; COVID-19; Coronavirus Infections/epidemiology; Datasets as Topic; Europe/epidemiology; Humans; Information Dissemination/ethics; International Cooperation/legislation & jurisprudence; Pandemics; Pneumonia, Viral/epidemiology; Public Health/economics; SARS-CoV-2; Workflow",10.1038/s41431-020-0637-5,True,en,Infrastructure and Tools
457,129-707-096-074-642,The NHGRI-EBI GWAS Catalog: knowledgebase and deposition resource.,2022,journal article,Nucleic acids research,Oxford University Press (OUP),United Kingdom,Elliot Sollis; Abayomi Mosaku; Ala Abid; Annalisa Buniello; Maria Cerezo; Laurent Gil; Tudor Groza; Osman Güneş; Peggy Hall; James Hayhurst; Arwa Ibrahim; Yue Ji; Sajo John; Elizabeth Lewis; Jacqueline A L MacArthur; Aoife McMahon; David Osumi-Sutherland; Kalliope Panoutsopoulou; Zoë Pendlington; Santhi Ramachandran; Ray Stefancsik; Jonathan Stewart; Patricia Whetzel; Robert Wilson; Lucia Hindorff; Fiona Cunningham; Samuel A Lambert; Michael Inouye; Helen Parkinson; Laura W Harris,"The NHGRI-EBI GWAS Catalog (www.ebi.ac.uk/gwas) is a FAIR knowledgebase providing detailed, structured, standardised and interoperable genome-wide association study (GWAS) data to >200 000 users per year from academic research, healthcare and industry. The Catalog contains variant-trait associations and supporting metadata for >45 000 published GWAS across >5000 human traits, and >40 000 full P-value summary statistics datasets. Content is curated from publications or acquired via author submission of prepublication summary statistics through a new submission portal and validation tool. GWAS data volume has vastly increased in recent years. We have updated our software to meet this scaling challenge and to enable rapid release of submitted summary statistics. The scope of the repository has expanded to include additional data types of high interest to the community, including sequencing-based GWAS, gene-based analyses and copy number variation analyses. Community outreach has increased the number of shared datasets from under-represented traits, e.g. cancer, and we continue to contribute to awareness of the lack of population diversity in GWAS. Interoperability of the Catalog has been enhanced through links to other resources including the Polygenic Score Catalog and the International Mouse Phenotyping Consortium, refinements to GWAS trait annotation, and the development of a standard format for GWAS data.",Genome-wide association study; Interoperability; Metadata; Population; Biology; Data science; Computer science; Computational biology; World Wide Web; Genetics; Medicine; Single-nucleotide polymorphism; Environmental health; Gene; Genotype,,"Animals; Humans; Mice; DNA Copy Number Variations; Genome-Wide Association Study; National Human Genome Research Institute (U.S.); Phenotype; Polymorphism, Single Nucleotide; Software; United States; Knowledge Bases",10.1093/nar/gkac1010,True,en,Infrastructure and Tools
483,144-495-742-964-546,FAIRifying a Quality Registry Using OMOP CDM: Challenges and Solutions.,2022,journal article,Studies in health technology and informatics,IOS Press,Netherlands,Daniel Puttmann; Nicolette De Keizer; Ronald Cornet; Eric Van Der Zwan; Ferishta Bakhshi-Raiez,"The need for health data to be internationally Findable, Accessible, Interoperable and Reusable (FAIR) and thereby support integrative analysis with other datasets has become crystal clear in the ongoing pandemic. The Dutch National Intensive Care Evaluation (NICE) quality registry adopted the Observational Medical Outcomes Partnership Common Database Model (OMOP CDM) to achieve a FAIR database. In the process of adopting the OMOP CDM, many modeling, technical, and communication challenges needed to be solved. Through communication with the OMOP CDM implementation community, previously done research and trial-and-error we found solutions that we believe can help other healthcare institutions, especially ICU quality registries, FAIRify their databases.",Interoperability; Observational study; Quality (philosophy); General partnership; Computer science; Process (computing); Knowledge management; Process management; Data science; Business; World Wide Web; Medicine; Philosophy; Epistemology; Pathology; Finance; Operating system,ETL Process; OHDSI; OMOP CDM; Quality Registry,"Databases, Factual; Delivery of Health Care; Electronic Health Records; Pandemics; Registries",10.3233/shti220476,True,en,Overview and Adoption of FAIR Principles
505,159-652-333-148-442,FAIR Genomes metadata schema promoting Next Generation Sequencing data reuse in Dutch healthcare and research.,2022,journal article,Scientific data,Springer Science and Business Media LLC,United Kingdom,K Joeri van der Velde; Gurnoor Singh; Rajaram Kaliyaperumal; XiaoFeng Liao; Sander de Ridder; Susanne Rebers; Hindrik H D Kerstens; Fernanda de Andrade; Jeroen van Reeuwijk; Fini E De Gruyter; Saskia Hiltemann; Maarten Ligtvoet; Marjan M Weiss; Hanneke W M van Deutekom; Anne M L Jansen; Andrew P Stubbs; Lisenka E L M Vissers; Jeroen F J Laros; Esther van Enckevort; Daphne Stemkens; Peter A C 't Hoen; Jeroen A M Beliën; Mariëlle E van Gijn; Morris A Swertz,"The genomes of thousands of individuals are profiled within Dutch healthcare and research each year. However, this valuable genomic data, associated clinical data and consent are captured in different ways and stored across many systems and organizations. This makes it difficult to discover rare disease patients, reuse data for personalized medicine and establish research cohorts based on specific parameters. FAIR Genomes aims to enable NGS data reuse by developing metadata standards for the data descriptions needed to FAIRify genomic data while also addressing ELSI issues. We developed a semantic schema of essential data elements harmonized with international FAIR initiatives. The FAIR Genomes schema v1.1 contains 110 elements in 9 modules. It reuses common ontologies such as NCIT, DUO and EDAM, only introducing new terms when necessary. The schema is represented by a YAML file that can be transformed into templates for data entry software (EDC) and programmatic interfaces (JSON, RDF) to ease genomic data sharing in research and healthcare. The schema, documentation and MOLGENIS reference implementation are available at https://fairgenomes.org .",JSON; Metadata; Computer science; Documentation; Schema (genetic algorithms); RDF; Reuse; Data sharing; Software; World Wide Web; Data element; Data integration; Data science; Information retrieval; Semantic Web; Database; Biology; Medicine; Programming language; Ecology; Alternative medicine; Pathology,,Delivery of Health Care; Genomics; High-Throughput Nucleotide Sequencing; Humans; Metadata; Software,10.1038/s41597-022-01265-x,True,en,Infrastructure and Tools
515,165-233-719-118-175,Augmenting laboratory COVID serology data granularity for SARS-CoV-2 reporting.,2022,journal article,International Journal of Population Data Science,Swansea University,,Esmond Urwin; Andy Harris; Jenny Johnstone; Erum Masood; Antony Chuter; Michael Ferguson; Joanne Martin; Neil Sebire; Philip Quinlan; Emily Jefferson,"<jats:p>ObjectiveThe global COVID pandemic has highlighted the need for the reporting of enhanced serology data from laboratory testing data. Qualitative results alone do not provide detailed data to understand levels of SARS-CoV-2 seroprevalence within a populace. To enable this, a minimum data set is required to support standardised data reporting.&#x0D;; ApproachThe CO-CONNECT project is concerned with the response to COVID within the UK and how datasets can be made Findable, Accessible, Interoperable and Reusable (FAIR). One aspect of this is a focus upon improving granular levels of COVID serology testing data being reported by national laboratories to the National Pathology Exchange (NPEx). A study was conducted to ascertain the essential data elements that could formulate a COVID Serology Data Standard (CSDS). Three NHS laboratories acting as pilot studies and NPEx have been actively involved with the development of the CSDS, together with clinicians and academics from the CO-CONNECT project.&#x0D;; ResultsFeedback from clinicians, academics and NPEx has been collected, together with NHS laboratory feasibility analysis to derive a minimum set of data elements that form a proposed data standard to standardise the reporting of laboratory COVID serology data for the UK. The proposed CSDS comprises twelve data elements in total, grouped into four main areas, (1) subject identifier and test date and time, (2) analyser types, test kits and samples, (3) qualitative results and (4) quantitative results. To further support the standardisation effort, a proposed Health Level Seven (HL7) message structure has been created to enable the reporting of the CSDS data elements to NPEx.&#x0D;; ConclusionThe CSDS has been created to help augment levels of reported granular data for laboratory COVID serology testing. If adopted, this could enable healthcare professionals to better understand the calibration of assays across multiple analyser types and thus antibody response levels.</jats:p>",Computer science; Coronavirus disease 2019 (COVID-19); Interoperability; Analyser; Data set; Serology; Identifier; Data science; Snowball sampling; Test (biology); Pandemic; Set (abstract data type); Data mining; Medicine; Artificial intelligence; Pathology; World Wide Web; Disease; Immunology; Infectious disease (medical specialty); Paleontology; Chemistry; Chromatography; Antibody; Biology; Programming language,,,10.23889/ijpds.v7i3.1887,True,en,FAIRification of data
